Qu'a réussi à obtenir la Société des Irlandais unis ,un groupe de protestants libéraux, anglicans et presbytériens
Qu'a réussi à obtenir la Société des Irlandais unis ,émancipation des catholiques
A quel objectif répondait la création de la Société des Irlandais unis ,obtenir une réforme du parlement irlandais, l'émancipation des catholiques et la révocation des lois pénales irlandaises
Comment la querelle entre de Menou d'Aulnay de Charnizay et de Saint-Etienne de la Tour finit-elle par se régler ,D'Aulnay de Charnizay et La Tour concluent des ententes avec le Massachusetts
Pourquoi le roi n'a pas pu correctement délimiter les limites des deux territoires ,la décision rendue confond les deux territoires
Pourquoi le roi n'a pas pu correctement délimiter les limites des deux territoires ,faible connaissance géographique de l'Acadie
Pourquoi le roi ne parvient pas à régler leur querelle ,la décision rendue confond les deux territoires
Sur quoi porte la dispute entre de Menou d'Aulnay de Charnizay et de Saint-Etienne de la Tour ,les limites de leur territoires respectifs
Quel événement cause la dispute entre de Menou d'Aulnay de Charnizay et de Saint-Etienne de la Tour,mort de Razilly, survenue en 1636
Comment Iwata a-t-il aidé au développement de jeux vidéos ,plusieurs idées novatrices
Quelle est la devise de Satoru Iwata ,un développeur ne dit jamais non
A quels jeux à succès Iwata a-t-il participé au développement ,Kirby's Dream Land et Super Smash Bros
Pour quels produits la société Creatures Inc. est-elle connue ,pour ses produits dérivés de l'univers Pokémon
Dans quel contexte Iwat est promu président de HAL ,difficulté financière
En quoi la société HAL était une toute petite entreprise en 1982 ,Iwata est recruté à plein temps par HAL Laboratory. Il est alors le cinquième employé
Comment la relation commerciale avec Nintendo débute ,HAL n'obtient qu'un projet en difficulté, Pinball, qu'Iwata finalise seul
Pourquoi Satoru Iwata commence à s'intéresser à Nintendo ,société a l'intention de sortir sa première console de salon, la Nintendo Entertainment System. Iwata prédit un succès commercial
Pourquoi est-il employé par HAL ,le seul spécialiste en développement de jeux vidéo
En quoi consistait le premier emploi de Satoru Iwata ,spécialiste en développement de jeux vidéo
En quoi consistait le premier emploi de Satoru Iwata ,en concevant des périphériques pour ordinateur
Le jeu vidéo était-il un loisir populaire quand Satoru a débuté ,encore à l'état embryonnaire à cette époque
Comment Satoru a pu sauver des emplois comme son père ,Satoru redressera les finances de Nintendo
Qu'a réussi à faire son père avec son mandat d'élu ,sauve plusieurs emplois
Comment Satoru a expliqué le comportement de son père ,sa famille « devait sûrement penser qu'il rejoignait une secte
Pourquoi le père d'Itawa ne lui a pas parlé pendant six mois ,déçu par le choix de carrière de son fils
Qui s'est exprimé à cet événement ,Lord Gosford
Quel historien est spécialiste de cet événement ,Jim Smyth
Sur quoi les historiens s'accordent-ils toutefois ,les origines populaires du mouvement
Pourquoi il ne pourrait pas y avoir de lien avec l'orangisme ,les loges orangistes n'existaient pas encore lorsque Lord Gosford s'est exprimé
Quel est la controverse autour de l'Ordre d'Orange ,Le lien entre cet événement, les bandes armées qui pourchassent les catholiques et la naissance de l'orangisme
Quel était le sujet de La Confession ,une allégorie ouvertement politique et polémique
Quel film Paradjanov était en train de tourner juste avant de mourir ,La Confession
Quand meurt Sergueï Paradjanov ,à l'âge de 66 ans
Quel réalisateur a influencé Sergueï Paradjanov ,Pasolini
Qu'est-ce qui était essentiel pour Sergueï Paradjanov ,la vision, l’image
Quand est-ce que l'OUA a été créée ,1963
En quoi la conférence de Bandung est connue ,naissance du concept de tiers monde
En quoi la conférence de Bandung est connue ,fondatrice du mouvement des non-alignés et base de la naissance du concept de tiers monde
Quand est-ce que l'idéologie panafricaine a commencé à décliner ,après les indépendances
Quand est-ce que l'idéologie panafricaine a commencé à décliner ,après les indépendances
Comment se construit l'imaginaire identitaire africain ,entre panafricanisme et volonté d'échapper à la logique des blocs de la guerre froide
Quand est-ce que l'Afrique a été representée pour la première fois ,1955
Quand est-ce que l'Afrique a été representée pour la première fois ,dès 1955, l'Afrique était représentée à la conférence de Bandung
Quand a t il soutenu sa thèse ,le 11 pluviose an XII (31 janvier 1804
A quel âge obtient il son diplôme ,à 20 ans
Quelles études suit Guillaume ,médicales
A quel âge Guillaume Marie André Ferrus part pour Paris ,à 15 ans
Combien de temps a duré le stage ,deux années
A quoi sert l'outil Ivalua Buyer ,réponde aux besoins particuliers de standardisation du Référentiel Fournisseurs de ce grand Groupe international
Qui est Daniel Amzallag ,Directeur Marketing produit et Stratégie partenaires
Qui a fait cette déclaration ,Daniel Amzallag
Qui est client ,PSA
Quel outil a été mis en place ,Ivalua Buyer
A quoi sert le couplage ,gestion dynamique et personnalisée du panel fournisseurs
Quel groupe a mis en place ce couplage ,PSA Peugeot Citroën
Quel groupe a mis en place ce couplage ,PSA Peugeot Citroën
Quel coupable permet une gestion dynamique et personnalité du panel fournisseurs ,couplage d’Ivalua Buyer et du portail B2B
Combien y a t-il de fournisseurs référencés ,73 000 fournisseurs référencés
Combien y a t-il d'utilisateurs actifs ,2 000 utilisateurs actifs
Les caves sont-elles pleines ,les caves sont pleines
Que tente le fils ,de sauver le domaine
Que préfère le fils ,une carrière d'œnologue
Que refuse son fils ,de devenir vigneron
De quoi se désintéresse le propriétaire ,de son exploitation
A qui vend-t-il sa récolte ,à un riche Californien
Que vend le baron ,sa prochaine récolte
Que vend le baron ,sa prochaine récolte
Qui est mort ,Dino
Qui a confié ses vignes ,Le baron de Malbray
Qu'aborde le téléfilm ,la viticulture
Où se retrouvent Jean et Maddy ,dans une grange
Que décide Jean ,qu'il fera, cette nuit, un enfant à Maddy
Quel est le fils des châtelains ,Jean Burton
Quand fête-t-on la gerbaude ,En 1929
Combien d'épisodes composent le téléfilm ,trois épisodes
Pourquoi se battent les familles bourguignonne ,pour conserver ses quelques hectares de vignes
Quels sont les milliardaires ,de la Napa Valley en Californie
Quel est l'enjeu du vin ,un féroce combat où l'argent le dispute à la gloire
Quel est le symbole du vin ,symbole de civilisation
Qui est en rivalité ,deux dynasties aristocrates florentines
Qui est en rivalité ,deux dynasties aristocrates florentines
Où est-ce que tout est beau ,Là
Où est cultivé la vigne ,sur le Rhin
Que font les pierres sèches ,retient la terre et laisse fuir les eaux
Qu'est-ce qui est hérissées de ceps ,Toutes les inclinaisons douces
Que porte le paysan ,des sacs et des paniers de terre
Depuis quand la fête de Noel est elle devenue importante,au début du XXe siècle
Qui a influencé la fête de Noel au Canada,influence chrétienne, française, britannique et américaine
Qui est à l'origine de la commercialisation de Noel,les États-Unis
Qui est à l'origine du sapin de Noel ,La reine Victoria
Qui est à l'origine du sapin de Noel ,La reine Victoria
Depuis quand Noel est devenu une fête familiale et communautaire,1870
Quels sont les autres symboles,le castor, la bernache du Canada, le plongeon huard, la Couronne et la Gendarmerie royale du Canada
Quel est le symbole principal du Canada,feuille d'érable
A quoi font référence les symboles nationaux du Canada,sources naturelles et historiques, ainsi que des peuples autochtones
Par quel article le patrimoine culturel du Canada est-il protégé,article 27 de la Charte canadienne des droits et libertés
PAr qui la culture canadienne est t'elle influencée,l'immigration récente de personnes provenant des quatre coins du monde
Le droit d'éligibilité a t-il été octroyé,le droit d'éligibilité est en revanche refusée
Les étrangers peuvent il participer à la vie politique,Les étrangers domiciliés depuis au moins 8 ans en Suisse (dont 3 mois dans le canton) obtiennent le droit de vote
Quels cantons sont les plus libéraux,cantons romands
depuis combien les temps les étrangers doivent être domiciliés en Suisse pour obtenir le droit de vote,8 ans
à quelle condition les citoyens ont le droit de vote,nationalité suisse et d'être domiciliés dans le canton de Genève
Comment sont organisées les services déconcentrés des administrations civiles de l'Etat,"circonscription régionale , / - circonscription départementale , / - circonscription d’arrondissement"
Où est situé la préfecture de région,chef-lieu de la région
Par qui est dirigée la région,le préfet de région
Depuis quel décret la région est une circonscription administrative de droit commun,décret no 92-604
Depuis quel décret la région est une circonscription administrative de droit commun,décret no 92-604 du 1er juillet 1992
Que retrouve-t-on dans une circonscription administrative,services extérieurs de l'État
Qui est troisième dans le classement mondial,Russie
Qui a établi le classement mondial,Havas Sports & Entertainment
Combien d'évènement sportifs la France comptabilise t-elle en 2018,1 600 événements sportifs
Combien de fois la France a-t-elle remporté la Coupe du monde de Football,2 reprises
Qui est Premier du classement mondial ,les États-Unis
Quelle chaine de télévision est une station publique,France 2
Qu'est ce qui a entrainé la concurrence des stations publiques,la légalisation des « radios libres
Qu'est ce qui a entrainé la concurrence des stations publiques,la légalisation des « radios libres
En quelle année est apparue la première chaine de télévision privée,1984
Quelles sont les trois principales chaîne de télévision,Les trois principales chaînes sont TF1, France 2 et M6
Par qui les stations de radio publiques sont elles concurrencées,des stations privées
Quelle est la tranche d'âge consommant le plus de cannabis,18 à 25 ans
Combien de pourcentage de personnes fumaient en 2005,29 %
Quel est le premier pays d'Europe en consommation d'alcool,les Irlandais
Quelle est la drogue illicite la plus consommée,le cannabis
A partir de quelle année a pu t-on constater une chute de la consommation de vin,les années 1960
Quel est le taux de mortalité en france,avant 65 ans
Quel est le pourcentage du PIB consacré aux soins et biens médicaux,8,8 % du PIB
Qui se place juste devant la France en termes de dépenses de santé,la Suisse, de la Norvège, du Danemark, du Luxembourg, et des États-Unis
Par qui est financé, en majorité, le système français,branche maladie de la sécurité sociale
Par qui est financé, en majorité, le système français,la branche maladie de la sécurité sociale
Quel pays bénéficie d'une des espérances les plus longues du monde,la France
En quelle année, l'obtention du baccalauréat était la plus faible,1936
A combien de pourcentage les enfants de cadre sont-ils diplômés de l'enseignement supérieur,77 %
Dans quel secteur de l'enseignement les inégalités sont elles les plus fortes,les grandes écoles
Dans quelle catégorie sociale les inégalités sont-elles les plus fortes,ouvriers
A quelle période la France a t-elle élargi la scolarisation,depuis la Libération
A quelle période la France a t-elle élargi la scolarisation,la Libération
Que représente le coût des opérations militaires,environ 1,8 milliard d'euros
A combien s'élèvent les pertes subies par l'activité industrielle et touristique,1,2 milliard d'euros
Qu'est ce que la Banque d'Israel évalue,les pertes subies par l'activité industrielle et touristique
Qu'est-ce qui est comptabilisé,le coût des opérations militaires menées par Tsahal (environ 1,8 milliard d'euros), ainsi que celui des dégâts causés par les 3 970 roquettes du Hezbollah
Que représente la somme,10 % du budget de l'État, et environ la moitié du budget de la défense israélienne
Qu'est-ce qui est détruit ,Les ponts, aéroports, ports, routes, transports en commun, usines électriques, stations services, postes d'essence, dépôts de nourriture, etc
par qui les pertes économiques sont-elles évaluées,le gouvernement libanais
Qu'est ce que le Liban a t-il perdu d'autre,sa saison touristique
Depuis quand le Liban était-il en phase de reconstruction,10 ans
A quel montant s'élève les pertes économiques,6 milliards de dollars
Où est située l'institution,en Suisse
Qu'est ce que l'institution contrôle,l'administration cantonale
Par qui est élue l'institution,le corps électoral
Comment est composée l'institution,3 magistrats et 3 suppléants
Pour combien de temps l'institution est élue ,un mandat de 6 ans
Qui s'occupe de tuer le couple ,Bardotto et Gesualdo
Qui est l'épouse ,Maria d'Avalos
Qui est Laura ,entremetteuse
Où sont les serviteurs de Bardotto ,antichambre
Quelles sont les armes en possession de Gesualdo ,une épée bien affûtée, une dague, un poignard et une petite arquebuse
Quelles sont les armes en possession de Gesualdo ,épée bien affûtée, une dague, un poignard et une petite arquebuse
Quel site est utilisé pour l'enseignement des lettres et sciences humaines ,site de Saint-Charles
Où sont construits les nouveaux bâtiments de l'Université ,avenue Robert-Schuman
Quel est est le modèle de développement ,campus à l'américaine
Quelle est la cause de l'accroissement du nombre d'étudiants ,développement de nouvelles disciplines
Combien d'étudiant étudient à l'Université d'Aix Marseille ,40 000
Que fait Bardotto ,apporta l'eau à son maître et l'aida à s'habiller
Quel activité a choisi le maitre ,chasser
Quand s'est déroulé le meurtre ,sixième heure de la nuit
Quelle est la réaction de Bardotto ,Étonné
Que constate le serviteur ,le petit porche de la porte donnant sur la rue était ouvert
Pourquoi les agriculteurs ruraux sont précarisés ,système d'échanges faiblement monétarisés
Quels pays rémunèrent le mieux les producteurs ,Les pays les plus urbanisés
Quel risque pèse les populations rurales ,pauvreté et l'insécurité alimentaire
Que permet l'accès au marché des intrants ,augmenter leur productivité
Que permettent les marchés urbains ,écoulement des surplus
Quel est le pourcentage d'emplois dépendant du secteur agricole en Afrique ,65 %
Quel est le pourcentage d'emplois dépendant du secteur agricole en Afrique ,65 %
Quelle est la principale conséquence des variations climatiques en Afrique ,instabilité politique
Quel risque pèse sur l'agriculture africaine ,dépendante aux variations du climat
Quel secteur est indispensable au développement africain ,secteur agricole
Quel est le pourcentage de personnes vivant en milieu rural en Afrique ,60 %
Qui est l'adversaire ,Lille OSC
Quelle est le classement du club ,première
Quel est le résultat de la rencontre ,deux buts à un
Combien de spectateurs sont réunis ,17 993
Où a eu lieu le record ,Amédée-Prouvost
Où évolue le club en 1963 ,Stade roubaisien
Qui prend la décision de quitter l'équipe professionnelle ,les dirigeants de l'US Tourcoing
Qui prend la décision de quitter l'équipe professionnelle ,dirigeants
A quelle période les deux clubs fusionnent ,1990
Que devient le CO Roubaix- Tourcoing en 1963 ,abandonne le professionnalisme
Que devient le CO Roubaix- Tourcoing en 1963 ,changement de nom marque
A quelle période le club est change de nomination ,1970
Où se trouvait l'institut des sciences historiquement ,Allées de Meilhan
Qui dirige l'université à cette époque ,doyen Léon Charve
Quel est la premier institut dont la construction débute ,faculté des sciences
Qui dirige la construction initialement ,Victor-Auguste Blavette
Où se trouve la faculté en 1919 ,Saint-Charles
D'où vient l'appelation Gillyweed ,référence à la giroflée (gillyflower) et aux branchies (gills
Quelle est la durée d'efficacité de la plante Gillyweed ,environ une heure
Quelles sont les vertus de la Gillyweed ,Plante relativement rare qui permet à celui qui la mâche de respirer et de nager facilement sous l'eau
Qui donne la plante Gillyweed à Harry durant la deuxième épreuve du Tournoi des trois sorciers ,Dobby
Dans quel tome de Harry Potter apparaît la plante Gilyweed ,Harry Potter et la Coupe de feu
"Quand ""le Miroir des pays"" a t-il été écrit ",vers 1557
Quels sont les ouvrages techniques de Seydi Ali Reis ,le Mir’ât-ı Kâinât (Miroir de l'univers) et le Kitâb ül Muhit: El Muhit fî İlmi'l Eflâk ve'l Buhûr (Livre des mers régionales et de la science de l'astronomie et de la navigation
"Que raconte l'ouvrage ""Le Miroir des pays"" rédigé par Seydi Ali Reis ",son expédition dans l'océan Indien
"Comment traduire ""le Miroir des pays"" en turc ",Mir'at Ül' Memalik
Quel est l'un des premiers récits de voyage de la littérature turque ,le Miroir des pays (en turc : Mir'at Ül' Memalik
Quel est la position de F. Alvarado concernant le mariage homosexuel en 2018 ,il déclare que la cour inter-américaine a « violé notre souveraineté et passée outre nos institutions
A quoi F. Alvarado doit le fait de s'être retrouver en tête des sondages en 2018 ,à son opposition au mariage homosexuel
Quel est le parti du candidat Fabrico Alvarado lors de la candidature à la présidentielle de 2018 au Costa Rica ,Parti de la restauration nationale
Quel est le parti du candidat Fabrico Alvarado lors de la candidature à la présidentielle de 2018 au Costa Rica ,Parti de la restauration nationale
Les candidats à la présidentielle de 2018 au Costa Rica sont-ils majoritairement favorable à la légalisation du mariage homosexuel ,La quasi-totalité des candidats à la présidentielle du 4 février 2018 au Costa Rica se déclarent en faveur d'une légalisation
Lors de l'élection présidentielle de 2018 au Costa Rica, quel candidat s'opposait à la légalisation du mariage homosexuel ,Fabricio Alvarado
Quel est le but de la Convention de Carthagène ,protéger, développer et gérer les eaux communes, de façon individuelle ou conjointe
Combien de contractants a la Convention de Carthagène ,21 États
Quelle est la date d'entrée en vigueur de la Convention de Carthagène ,11 octobre 1986
Quelle est la date d'entrée en vigueur de la Convention de Carthagène ,le 11 octobre 1986
Quelle est la date d'adoption de la Convention de Carthagène ,le 24 mars 1983
Quel est le surnom de la Convention pour la Protection et le Développement de l'Environnement marin de la région de la Grande Caraïbe ,Convention de Carthagène
Où est situé la façade caraïbe du continent américain ,étend de l'Amérique centrale aux plateau des Guyanes en passant par les plaines côtières de Colombie et du Venezuela
Quelles sont les Iles Lucayes ,Bahamas et les îles Turques-et-Caïques
Les îles Lucayes sont situés dans quel arc ,arc antillais
Avec quoi les Caraïbes sont-elles souvent confondues ,les Antilles
Que comprend les Antilles ,les Grandes Antilles et les Petites Antilles
Quel est le pseudonyme de Seydi Ali Reis ,Kâtib-i Rumî (le Lettré d'Anatolie
Quand meurt Seydi Ali Reis ,en janvier 1563
Où meurt Seydi Ali Reis ,Constantinople
Qui nomme Seydi Ali Reis commandant de la flotte de l'océan Indien en 1560 ,le grand vizir Rüstem Pacha
Qui nomme Seydi Ali Reis commandant de la flotte de l'océan Indien en 1560 ,le grand vizir Rüstem Pacha
Quand est-ce que Seydi Ali Reis arrive à Constantinople ,en Rajab 964 (mai 1556
Comment l'armée des Ottomans est constitué ,une armée avec 200 canonniers et des éléphants
Qui tue Nasir ul-Mulk ,Ahmed Shah
Quelle est l'ambition de Nasir ul-Mulk ,se faire proclamer sultan
Où est situé la forteresse de Burudj ,dans l'actuel district de Ratnagiri
Lors de la bataille aux Portugais, Seydi Ali meurt-il ,Seydi Ali échappe à des assassins envoyés pour le tuer
Après la ligne Kappelskar et Naantali, où est ce que le navire sera redéployé ,Travemünde - Malmö
Quand est-ce que le Vizzavona réalise son escale à Langnas ,2013
A partir de quelle année le navire Vizzavona est-il placé sur la ligne Helsinki-Rostock ,2012
Durant quelle période le navire était dévolu à la ligne Kapellskär et Naantali ,De 1999 à 2009
Qu'est ce qu'effectue le navire en août 2015,la ligne Hangö
A quoi répond l'optimisation de la zone monétaire,critères énoncés par Robert Mundell
Pourquoi la zone monétaire n'est pas optimale,niveaux de coordination des politiques budgétaires et économiques hétérogènes
Qu'est-ce qui entraîne une hausse de la croissance,la baisse des coûts d'échange et de financement
Qu'est-ce que l'euro accélère,la mise en place d'une Europe fédérale
Les pays membres sont-ils sans liberté,Les pays membres conservent une totale liberté
Qu'implique la stabilité des prix,maitrise de l'inflation et de la création monétaire
Quel est le critère pour les pays candidats à l'adhésion à la zone euro,arrimer leur monnaie au Mécanisme de taux de change européen (MCE
Les actions des pays sont-elles encadrées,Pacte de stabilité et de croissance (PSC
Quelle est la mission principale de la BCE,stabilité des prix
Pour quelle raison le poids de la livre sterling s'est réduit,recul du poids de l'économie britannique
Pour quelle raison le poids de la livre sterling s'est réduit,recul du poids de l'économie britannique
Le poid de quelle monnaie a diminué,livre sterling
Où est surtout utilisé l'euro,échanges commerciaux, il est surtout utilisé avec les pays méditerranéens
Quelle est la monnaie de référence dans le Système monétaire international,euro
Au sein de quel système l'euro est devenu une monnaie de référence,Système monétaire international
Combien de temps la disette,dernières années du royaume
Quelle autre explication,réchauffement climatique
Quelles sont les régions voisines,royaumes élamites et les tribus des Martu/Amorrites
Quelles sont les causes de la chute de la troisième dynastie d'Ur,organisation bureaucratique complexe de l'empire
Quand a eu lieu la chute de la troisième dynastie,quarantaine d'années après la mort de son plus grand roi
Qu'est-ce qui se transforme en matière,énergie
En quoi se transforme l'énergie,matière
Quel domaine a été sujet à d'importants remaniements,cosmologie moderne
Quelle était le modèle avant le Big Bang,théorie de l'univers statique et éternel
Depuis quand le Big Bang est considéré comme modèle satisfaisant,1962
L'abbé Lemaître fut un pionner dans quel domaine,utilisation de la relativité générale
A partir de quelle théorie l'abbé Lemaître a proposé le modèle du Big Bang,théorie de l'« atome primitif
Par qui a été proposé le modèle du Big Bang après 1922,abbé Lemaître
Par qui a été proposé le Big Bang,Alexandre Friedmann
Quand a été proposé le Big Bang,1922
Par qui l'évêque de Varmie obtient-il l'immédiateté impériale,empereur Charles IV
Quand l(évêque de Varmie obtient-il l 'immédiateté impériale,1356
Quand Riga devient-il archevêché,1255
Qui fonda l'évêché de Riga,Albert de Buxhoeveden
Qui fonda l'évêché de Riga,Albert de Buxhoeveden
Où est situé Prince-évêque,en dehors du Saint-Empire
Qui devient indépendants,provinces proches du centre
Contre qui les campagnes sont menées,entités politiques
Combien  de temps règne le fils du précédent,vingt-quatre années
Combien  de temps règne le fils du précédent,vingt-quatre années
Quel est le fils du précédent,Ibbi-Sîn
Comment sont les incursion des tribus amorrites,de plus en plus violentes
Comment se nomme la langue propre des Séfarades ,le judéo-espagnol
Après quel événement les Séfarades sont-ils expulsés ,la Reconquista
Par qui les Séfarades sont -ils chassés ,les autorités chrétiennes
En quelle année les Séfarades sont-ils expulsés ,1492
Comment se nomme les juifs issus de la péninsule Ibérique,Séfarades
Quels textes détaillent les fastes et néfastes de l'année ,des textes divinatoires
"Durant quelle période la religion ""populaire"" existe-t-elle en Chine",la période Qin
Sur quoi se repose les autres formes de divination ,sur l'observation des phénomènes naturels
Quels os sont utilisés pour interpréter le futur ,des os ou des carapaces de tortues
Quel est l'art servant à prédire l'avenir ,divination
Quel est l'art servant à prédire l'avenir ,La divination
Par qui Jean-Pierre Denis est-il secondé ,Ronan Le Moal
Qui préside le Groupe Arkéa en 2007 ,Georges Coudray
Quelle est l'une des missions du groupe Arkéa ,des acquisitions
Quelles régions sont fédérées par le Crédit mutuel Arkéa ,la Bretagne, le Sud Ouest (Bordeaux) et le Massif Central
Où est basé Le Crédit mutuel Arkéa ,Le Relecq-Kerhuon
Où est situé le Crédit mutuel Arkéa ,Le Relecq-Kerhuon
Sur quelle île Napoléon avoue regretter la Guerre d'indépendance espagnole ,Sainte-Hélène
A combien s'élève les pertes pour l'armée française ,300 000 soldats français
Que rata l'Espagne suite à cette victoire ,la modernisation agricole et industrielle au XIXe siècle
Quelle institution joua un rôle important dans la résistance espagnole ,l’Église catholique
Quel est le ressenti des Espagnols face à cette Guerre d'indépendance ,un fier souvenir
Que consacre la Constitution espagnole ,droits de l'homme et notamment un suffrage universel masculin
De quoi la première Constitution espagnole s'inspire-t-elle ,Constitution française de 1791
Au jour de quel Saint la première Constitution a-t- elle été nommée ,Saint-Joseph
