Depuis quand ce modèle est importé en Europe ,1986
Quel moteur equipe l’UAZ eu Europe ,VM Motori
Qui importait l’UAZ ,Martorelli
Quels sont les concurrents de l’UAZ ,Jeep, Land Rover
Par quoi sont attirés Jim et Selena ,des lumières venant du balcon d'un immeuble
A qui doivent ils leur salut ,un chauffeur de taxi
Où se trouve la base des survivants ,une base près de Manchester
Par qui sont ils rattrapés ,contaminés
Quel est le prenom de la fille du chauffeur de taxi ,Hannah
Dans quel lieu rentre Jim à sa sortie d'hôpital ,une église
Dans quel lieu rentre Jim à sa sortie d'hôpital ,église
Que découvre Jim en entrant dans l'église ,un macabre spectacle de corps entassés
De quelle couleur sont les yeux des gens dans l'église ,rouge
De quelle couleur sont les yeux des gens dans l'église ,rouge
Qui sauvent Jim ,Marc et Selena
Qui sont les deux survivants ,Marc et Selena
Où se réveille Jim vingt-huit jours plus tard ,à l'hôpital
Dans quel hôpital se réveille Jim ,St Thomas de Londres
Dans quelle ville se situe l'hôpital où s'est réveillé Jim ,Londres
Dans quelle ville se situe l'hôpital où s'est réveillé Jim ,Londres
Combien de défenseurs des animaux se retrouvent dans le laboratoire ,Trois
Où se rendent les trois défenseurs des animaux ,un laboratoire
Quel est le critère de sélection pour être éligible selon le mouvement raelien ,individus ayant un coefficient intellectuel supérieur de 50 % à la moyenne
Quel est le critère pour devenir électeur ,coefficient intellectuel supérieur de 10 % à la moyenne
Quel est le critère pour devenir électeur ,coefficient intellectuel supérieur de 10 % à la moyenne
Ce système politique sera-t-il imposé aux citoyens ,pas imposé
Comment sera choisi ce système politique ,voté par tous les citoyens désirant s'y soumettre
quelles sont les exigences attendues pour ce système politique ,moralité et de conscience
Où se situe le château de Stridula ,probablement près de Squillace
Comment s'appelle le frère de Guillaume ,Drogon
Quelles sont les deux principautés normandes qui émergent à la mort de Guillaume ,le comté d'Aversa, plus tard principauté de Capoue, et le comté d'Apulie, qui deviendra duché d'Apulie
Quelles sont les deux principautés normandes qui émergent à la mort de Guillaume ,le comté d'Aversa, plus tard principauté de Capoue, et le comté d'Apulie, qui deviendra duché d'Apulie
Par qui est vaincu Guillaume en 1045 en Apulie ,Argyrus
Dans quelle région Guillaume et Guaimar lancent-ils leur conquête en 1044 ,la Calabre
Quelle baronnie le chef normand Drogo de Hauteville reçoit-il en 1043 ,Venosa
Quelle baronnie reçoit le chef normand Pierre en 1043 ,Ascoli
Quelle baronnie reçoit le chef normand Pierre en 1043 ,Trani
Quelle baronnie reçoit le chef normand Tristan en 1043 ,Montepeloso
Quelle baronnie reçoit le chef normand Guillaume en 1043 ,Ascoli
Quelle baronnie reçoit le chef normand Asclettin en 1043 ,Acerenza
Quelle baronnie reçoit le chef normand Asclettin en 1043 ,Acerenza
Qui commande les Byzantins en septembre 1041 ,Exaugustus Boioannes
Qui commande les Byzantins en septembre 1041 ,Exaugustus Boioannes
Qui commande les Byzantins en septembre 1041 ,Guaimar IV
Où est emmené Exaugustus Boioannes après avoir été fait prisonnier par les Normands ,à Bénévent
Quand les Normands capturent-ils le nouveau catépen byzantin, Exaugustus Boioannes ,Le 3 septembre 1041
Qui remplace Aténolf en février 1042 ,Argyros
Qui remplace Aténolf en février 1042 ,Argyros
Qui commandent les Normands en septembre 1041 ,Arduin et Aténolf
De combien de places le club régresse-t'il en 2006/2007 ,deux places
Quel est le score final du match en 2006/2007 contre le THW Kiel ,31 à 33
Quelle coupe européenne le club intègre-t'il en 2006/2007 ,Coupe de l'EHF
Contre qui le club s'incline-t'il en huitième de finale en 2006/2007 ,THW Kiel
Contre qui le club s'incline-t'il en huitième de finale en 2006/2007 ,SC Magdebourg
En quelle année le club Rhein-Neckar Löwen entre-t'il sur la scène européenne ,2006/2007
En quelle année le club Rhein-Neckar Löwen entre-t'il sur la scène européenne ,2006/2007
En quelle année le club Rhein-Neckar Löwen entre-t'il sur la scène européenne ,2006/2007
Quand est né Nicolas Berggruen ,10 août 1961
Qui est Nicolas Berggruen ,un investisseur, philanthrope et collectionneur d'art américano-allemand
Qui est Nicolas Berggruen ,investisseur, philanthrope et collectionneur d'art américano-allemand
Quel est son rôle dans le holding privé Berggruen Holdings ,président et fondateur
Quelle publication, Nicolas Berggruen a-t'il co-fondé ,The WorldPost
Qu'est-ce que The WorldPost ,une publication de médias dédiée aux problèmes mondiaux
Qui a écrit le poème Invictus,William Ernest Henley
Qui a écrit le poème Invictus,William Ernest Henley
A quel genre de poème ressemble Invictus,stoïciste
A quel genre de poème ressemble Invictus,If de Kipling datant de 1895, ou Vitai Lampada de Henry Newbolt, écrit en 1892
Quels hommes politiques ont évoqué ce poème,Franklin D. Roosevelt et de Nelson Mandela
Dans quels supports le poème Invictus a t-il été utilisé,dans des clips publicitaires, des chansons et des jeux vidéo
Quel a été le destin de ce poème au cours du 20ème siècle,connu une étrange popularité : favori de Franklin D. Roosevelt et de Nelson Mandela, il sera aussi utilisé dans des clips publicitaires, des chansons et des jeux vidéo
Quel a été le destin de ce poème au cours du 20ème siècle,sauvé de l'oubli et a ensuite connu une étrange popularité
quel adage Q a t-elle placé dans ses leçons,Murder your darlings
quel adage Q a t-elle placé dans ses leçons,Épurez sévèrement vos écrits
Comment se nomme la leçon de Q,De l'Art d'écrire
Comment se nomme la leçon de Q,De l'Art d'écrire
Quel film reprend cet adage,Kill Your Darlings
Quel est le nom de famille des personnages de Peter pan Wendy et ses frères,Darling
Où Q prononçait-elle ses leçons,à Cambridge
Vers quels pays l'ouverture de l'économie française se manifeste t-elle,ses partenaires européens
Vers quels pays l'ouverture de l'économie française se manifeste t-elle,partenaires européens
Vers quels pays l'ouverture de l'économie française se manifeste t-elle,vis-à-vis de ses partenaires européens
Quelle est l'une des caractéristiques de l'économie française,fortement extravertie
Quelle est l'une des caractéristiques de l'économie française,fortement extravertie, notamment vis-à-vis de ses partenaires européens
Pourquoi l'économie française est-elle ouverte vers l'extérieur,l’épuisement ou à l’insuffisance des ressources minières et énergétiques
Pourquoi l'économie française est-elle ouverte vers l'extérieur,liée à l’épuisement ou à l’insuffisance des ressources minières et énergétiques du pays, qui l’obligent à importer, et à la taille relativement réduite de ce pays
Comment se situe la France au niveau mondial en termes d'exportation et d'importation,Selon l'OMC, en 2017, la France est le 8e exportateur (535 milliards de dollars d'exportations) et le 6e importateur (625 milliards de dollars d'importations) mondial de marchandises
Comment se positionne la France dans le monde en termes de services,4e exportateur (248 milliards de dollars d'exportations) et 4e importateur
Comment se positionne la France dans le monde en termes de services,En ce qui concerne les services, elle en est le 4e exportateur (248 milliards de dollars d'exportations) et 4e importateur (240 milliards de dollars d'importations) mondial
Qui était le 3eme comte,James Butler, 3e comte d'Ormond
Combien de temps la dynastie BUTLER y a vécu ,plus de 500 ans
Combien de temps la dynastie BUTLER y a vécu ,Ils étaient Comtes, Marquis et Ducs d'Ormonde et ont vécu dans le château pendant plus de 500 ans
En quelle année a-t-elle quitté le château,1935
En quelle année a-t-elle quitté le château,jusqu'en 1935
Qui était la 2ème femme du roi henri VIII,Lady Margaret Butler
Qui était la 2ème épouse du roi Henri VIII,Anne Boleyn
A qui appartient le château de Kilkenny,Office of Public Works
Quelle famille l'a possédé pendant sept siècles,famille Butler
Quelle famille l'a possédé pendant sept siècles,Il est resté la possession de la famille Butler
A quoi sert la tour de la parade,La Tour de la Parade est un lieu de conférences
Pour quel prix a-t-il été transféré à la population,qu'il soit transféré à la population de Kilkenny en 1967 pour 50 £ irlandaises
Est-il ouvert au public,Les jardins et le parc autour du château sont ouverts au public
Qui est le haut commissaire des Nations unies pour les réfugiés ,António Guterres
Quelle est la plus grande crise de notre ère ,La crise des réfugiés syriens
Combien de personnes environ ont fui la Syrie durant la crise syrienne ,quatre millions
Combien de personnes environ ont fui la Syrie durant la crise syrienne ,quatre millions
Dans quels pays les syriens ont-il fui durant la crise syrienne ,Jordanie, Liban, Turquie, Irak ou Kurdistan irakien
Dans quels pays les syriens ont-il fui durant la crise syrienne ,Jordanie, Liban, Turquie, Irak ou Kurdistan irakien
Pourquoi les syriens ont ils fui durant la crise syrienne ,Ils fuient la guerre qui les entoure
Pourquoi les syriens ont ils fui durant la crise syrienne ,Pour échapper aux violences
Quelle est la nourriture du léopard de mer ,krill et les juvéniles d'autres espèces de phoques
Quelle est la nourriture du léopard de mer ,phoques constituent sa principale nourriture, il est renommé pour sa férocité envers les manchots qui constituent également son alimentation
Combien peut mesurer la femme léopard de mer ,4,5 mètres
Quel est le caractère du léopard de mer ,Craintif et solitaire
Quel est l'effectif du léopard de mer ,300 000
Quel est l'effectif du léopard de mer ,300 000
Combien peut peser la femme léopard de mer ,600 kilogrammes
Combien peut peser la femme léopard de mer ,600 kilogrammes
que comporte la bouche droite ,une succession[pas clair] de trois peaux épaisses
que comporte la bouche droite ,une succession[pas clair] de trois peaux épaisses
d'où provient la pastille noire ,un mélange (masala) de riz bouilli et de poudre de manganèse
qu'est-ce qui est glissé entre les peaux ,petits morceaux de roseau
qu'est-ce qui est glissé entre les peaux ,De petits morceaux de roseau
pourquoi les roseaux sont-ils glissés sous les peaux,pour donner le « buzz » caractéristique de cet instrument
comien mesure la bouche droite ,17 cm
quand a eu lieu l'élection du du directeur général de l'UNESCO ,en 1999
Quand a eu lieu le retour des Etats-Unis ,2003
Quand a eu lieu le retour des Etats-Unis ,en 2003
Qaund l'UNESCO s'est-elle engagée dans un plan de réduction des dépenses ,2003
Qaund l'UNESCO s'est-elle engagée dans un plan de réduction des dépenses ,en 2003
au profit de quoi la réduction nette du budget a-t-elle eu lieu ,au profit de programmes désormais financés, et donc aussi pilotés ou gérés, par des États membres ou des entreprises commerciales
au profit de quoi la réduction nette du budget a-t-elle eu lieu ,de programmes désormais financés
quand le courrier de l'UNESCO est-il de nouveau publié ,à partir de 2017
Par quoi se caractérise le XVIIIième siècle ,par les guerres intercoloniales
Quels sont les alliés des Français ,Hurons et les Algonquins, et les Hollandais — au début — ainsi que les Britanniques par la suite
Entre qui éclatent maintes guerres ,les Français, les Hollandais, les Britanniques et les tribus amérindiennes
Comment se nomment les guerres intercoloniales ,French and Indian Wars
Comment se nomment les guerres intercoloniales ,French and Indian Wars en Nouvelle-Angleterre
Pour quoi a lieu la compétition ,pour les territoires, les bases navales, la fourrure et la pêche
Avec combien de victoires Brodeur a terminer la saison ,43 victoires
Quel trophée a remporter Brodeur deux année consécutive ,trophée William M. Jennings
En quel année Brodeur termine la saison avec 43 victoires ,1997-1998
Contre qui perd Brodeur alors qu'il est en lice pour le trophée Vézina ,Hašek
Contre qui perd Brodeur alors qu'il est en lice pour le trophée Vézina ,Hašek
Contre qui perd Brodeur alors qu'il est en lice pour le trophée Vézina ,Hašek
Combien de blanchissages Brodeur réalise t'il en 1997-1998 ,dix
Combien de blanchissages Brodeur réalise t'il en 1997-1998 ,dix blanchissages
Ou trouve t'on la population la plus aisée de Moscou ,dans les quartiers occidentaux du centre-ville
Ou trouve t'on la population la plus aisée de Moscou ,les quartiers occidentaux du centre-ville
Ou trouve t'on la population la plus aisée de Moscou ,quartiers occidentaux du centre-ville comme le vieux quartier de l'Arbat
Que fait t'on dans les rocades circulaires ,dédié au commerce et aux communications
Que fait t'on dans les rocades circulaires ,commerce et aux communications
Quels sont les quartiers les plus récents de Moscou ,Kountsévo et Sérébriany
Quel rue est est considéré comme présitigieuse et animées ,la rue Tverskaïa (rue de Tver
Comment sont relié Moscou et ses régions voisines ,routes radiales (prospekt
COmment réagit un cheval entier si une jument se trouve à proximité,il peut s'emballer en sentant sa présence et tout faire pour aller la rejoindre
Pourquoi castrer un cheval,adoucir son comportement et le rendre plus facile à maîtriser
De quoi dépend avant tout le caractère,l'éducation et de l'origine
De quoi dépend avant tout le caractère,éducation et de l'origine de chaque cheval
De quoi dépend avant tout le caractère,de l'éducation et de l'origine de chaque cheval
Qulles sont les races d'étalon les plus dociles,les races rustiques et les races de trait
COmment peuvent être les hongres castrés,caractériels
"A quelle date a été créé le terme ""hongre""",les années 1100
"que signifie ""hongrer""",procédure de castration
"que signifie ""hongrer""",châtrer les chevaux de monte
Comment traduire hongre en anglais,gelding
Comment traduire hongre en anglais,gelding
"De quel pays est originaire le terme ""hongre""",turque
"Que signifie ""hongre"" en vieux norrois",stérile
qui est le père de l'enfant de kelly,Lucifer
qui est le père de l'enfant de kelly,Lucifer
quel rôle a kelly dans la vie privée de lucifier,sa maîtresse
qu'est ce qui est  l'origine de la colere de lucifier,menace d'avorter l'enfant
quelle est la réaction de lucifer quand Sam le met dehors,devient encore plus furieux
quelle est la réaction de lucifer quand Sam le met dehors,furieux
quelle est la conséquence de l'intervention de Castiel et Crowley ,éviter le massacre
que recherche Lucifer de ses fans ,avoir leurs dévotions
que recherche Lucifer de ses fans ,les faire tuer pour lui
quel est est le but de la création de DIeu,lutter contre Amara
quel est est le but de la création de DIeu,aucun plan
quel est est le but de la création de DIeu,aucun plan
pouruqoi lucifier s'est-il réconcilié avec dieu,pour l'aider à lutter contre Amara
pouruqoi lucifier s'est-il réconcilié avec dieu,lutter contre Amara
qui a exercisé lucifer du vaisseau,les Ténèbres
qui a exercisé lucifer du vaisseau,les Ténèbres
Quel est l'intérêt de la privatisation des cabinets pour les marques de supermachés britanniques ,étendre leurs investissements au marché des services financiers
Quel est l'intérêt de la privatisation des cabinets pour les marques de supermachés britanniques ,étendre leurs investissements au marché des services financiers déjà privatisé
Quel est l'intérêt de la privatisation des cabinets pour les marques de supermachés britanniques ,étendre leurs investissements au marché des services
Quel est le statut des cabinets de solliciteurs ,le statut de sociétés civiles
Qui détient le capital social des cabinets de solliciteurs ,ses membres
Quel sera la conséquence de la privatisation par l'Etat anglais des ces cabinets ,les transformer en copropriétés soumises à une assemblée d'actionnaires
Quel est la crainte de certains vis à vis de la privatisation des cabinets de solliciteurs ,que le secret professionnel que le solicitor doit à ses clients ne soit menacé
En quelle année le film 2012 est-il sorti ,2012
Quel est le thème du film 2012 ,la vie
Quel est le premier élément clé de l'album ,le temps présent
Quel est le premier élément clé de l'album ,le temps présent
Quel est le second élément clé de l'album ,les prophéties du calendrier maya
Quel est le second élément clé de l'album ,les prophéties du calendrier maya
Quel est le troisième élément clé de l'album ,l'horloge de la fin du monde dite horloge de l'Apocalypse
Quand François-Xavier Lafrance ouvre-t-il le 1er établissement d'enseignement supérieur de langue Française ,en 1854
Quand François-Xavier Lafrance ouvre-t-il le 1er établissement d'enseignement supérieur de langue Française ,en 1854
Où François-Xavier Lafrance ouvre-t-il le premier établissement d'enseignement supérieur de langue française ,à Memramcook
Comment s'appelle le premier établissement d'enseignement supérieur de langue française ,le séminaire Saint-Thomas
Comment s'appelle le premier établissement d'enseignement supérieur de langue française ,le séminaire Saint-Thomas
Quand ferme-t-il ses portes ,en 1862
Quand ouvre-t-il de nouveau ses portes ,deux ans plus tard
Quand ouvre-t-il de nouveau ses portes ,deux ans plus tard
Combien d'oeuvres marquent-elles la reconnaissance acadienne ,Deux œuvres
Quelle est la plus importante oeuvre marquant la reconnaissance acadienne ,le poème Evangéline
Par qui le poème Evangeline est-il publié ,par l'Américain Henry Longfellow
Quand Henry Longfellow publie-t-il Evangeline ,en 1847
Quand Henry Longfellow publie-t-il Evangeline ,en 1847
Qu'est ce que le couple d'Evangeline et Gabriel représente-t-il pour les acadiens ,leur histoire, leur dispersion et leurs retrouvailles
Outre les missionnaires et les prêtre, quel autre type de population fait sa place ,quelques notables
Quels sont les notables qui se font leur place et dans quel endroit ,Amable Doucet à l'Anse-des-Belliveau, Joseph Gueguen à Cocagne, Otho Robichaud à Néguac et Joseph Arsenault à Malpèque
Quels fonctions et rôles occupent-ils ,diverses fonctions publiques et religieuses
Quels fonctions et rôles occupent-ils ,"diverses fonctions publiques et religieuses en plus d'occuper souvent le rôle de notaire et de greffier , ils sont aussi entrepreneurs"
Par rapport à qui les acadiens sont-ils plus modestes ,les anglophones
Y-a-t-il une classe moyenne ,il n'y a pas réellement de classe moyenne
Y-a-t-il une classe moyenne ,il n'y a pas réellement de classe moyenne
Que doivent faire les Acadiens pour se reloger ,demander une concession au gouvernement
Quelles sont les conditions pour obtenir une concession du gouvernanement ,la dimension des maisons à construire et le délai accordé pour le défrichement
Pourquoi les citoyens du Madawaska sont-ils privilégiés ,car les Loyalistes se sont établis au sud et le gouvernement souhaite coloniser la région pour éviter son annexion par le Bas-Canada
Quelle population passe de 8408 à 87000 personnes en 68 ans ,acadienne des Maritimes
Quelle population passe de 8408 à 87000 personnes en 68 ans ,La population acadienne des Maritimes
Quel est le taux de mortalité infantile des acadiens des maritimes ,44 %
Où se situe l'Acadie par rapport aux zones d'influence française et anglaise ,entre les deux
Quand Samuel Argall détruit-il deux établissements et en chasse les habitants ,En 1613
Quel habitant reste après la destruction des établissements par Samuel Argall ,Charles de Biencourt
De qui Charles de Biencourt est-il le fils ,de Poutrincourt
Qui décide de rester sur place ,Charles de Biencourt
Qui décide de rester sur place ,Charles de Biencourt
Comment s'appelle le cheval élevé en Ouzbékistan pour sa viande et son lait ,Karabaïr
Comment s'appelle le jeu équestre traditionnel d'Asie centrale ,kokpar
Pour quoi le Karabaïr est-il de moins en moins utilisé ,la traction
Pour quoi le Karabaïr est-il élevé de nos jours ,pour sa viande et son lait
Où a lieu l'élevage du Karabaïr ,Ouzbékistan
Où a lieu l'élevage du Karabaïr ,Ouzbékistan
Quel est le domaine de l'art qui échappe à l'Afrique,Aucun
quand sont apparues les 1ere cuilleres,XVIe siècle
quand sont apparues les 1ere cuilleres,XVIe siècle
quand sont apparues les 1ere cuilleres,XVIe
qui les a apportées,Portugais
qui inspira loccident en matière de peinture,l'Afrique
qui inspira loccident en matière de peinture,Afrique
ou sont présents les artistes africains,partout
Quelle est la langue officille de la province du Quebec ,français
Quelle est la langue officille de la province du Quebec ,français
Quelle langue est utilisée majoritairement au Nunavut ,inuktitut
Quelle langue est utilisée majoritairement au Nunavut ,inuktitut
Quelle province canadienne est officiellement bilingue ,Nouveau-Brunswick
Quelle province canadienne est officiellement bilingue ,Nouveau-Brunswick
Au Canada où vivent majoritairement ceux dont la première langue est le français ,dans la province du Québec
Au Canada où vivent majoritairement ceux dont la première langue est le français ,Québec
Combien y a-t-il de langues officielles au Nunavut ,trois
Combien y a-t-il de langues officielles au Nunavut ,trois
quelle est la langue la plus parlée au Canada ,anglais
quelle est la différence de statut entre l'anglais et le français au Canada ,égal
Quelle langue doit-on parler pour obtenir la citoyenneté canadienne ,soit le français soit l'anglais
Quelle est la langue utilisée pour la signalisation routière au Canada ,bilingue
La signalisation routiere est-elle uniforme au Canada ,utilisation de la signalisation routière bilingue varie d'une province à l'autre
Quand l'assemblée nationale bulgare élit-elle le souverain ,Le 3 juillet 1887
Où l'assemblée nationale bulgare se réunit-elle ,à Tarnovo
Que décide Alexandre de Battenberg ,il annonce sa renonciation définitive au trône
Qui est proclamé prince de Bulgarie ,Ferdinand
Qui est proclamé prince de Bulgarie ,Ferdinand
Quand Ferdinand quitte-t-il Ebenthal ,le 9 août
Quand Ferdinand quitte-t-il Ebenthal ,le 9 août
Quelle est la distance entre le trou noir de M87 et son centre ,25 pc
quand ce décalage est-il peut-être intervenu ,durant la fusion de deux TNSM
Quand une étude a-t-elle échoué à trouver un déplacement statistique ,En 2011
Par quoi pense-t-on que le trou noir a été éjecté ,par le jet
Qu'est ce qui manque dans l'étude ,les différences spectroscopiques entre les étoiles et le noyau galactique actif
Qu'est ce qui manque dans l'étude ,les différences spectroscopiques entre les étoiles et le noyau galactique actif
Dans quelle matières sont façonnés les bijoux algériens ,argent
Comment sont décorés les bijoux kabyles ,cloisonnés de fils ou filigranes, sertis de corail ou émaillés
Quelles sont les couleurs préférés dans l'art algérien en matière de bijoux ,bleu foncé, vert et jaune
Quelles sont les couleurs préférés dans l'art algérien en matière de bijoux ,bleu foncé, vert et jaune
quels sont les bijoux fabriqués en Kabylie ,bracelets de bras ou de chevilles, les boîtes d'allumettes, bagues, colliers, broches, fibules, croix du Sud
quelles sont les régions d'Algérie qui créent des bijoux ,Kabylie, Aurès, Sud algérois, Ghardaïa, Tamanrasset
quelles sont les régions d'Algérie qui créent des bijoux ,Kabylie, Aurès, Sud algérois, Ghardaïa, Tamanrasset
A quoi servent les leuconostoc ,dégradent les cellules végétales
A quoi servent les glucosinolates ,se défendre contre les herbivores
A quoi servent les glucosinolates ,défendre contre les herbivores
Pourquoi a t-on fait évoluer les variétés de choux ,être moins riches en glucosinolates
Pourquoi a t-on fait évoluer les variétés de choux ,moins riches en glucosinolates
Pourquoi est-ce plus aisé de consommer les choux cuits ,diminuant la possibilité de transformer les glucosinolates en composés actifs toxiques
quelles bactéries dégagent des éléments toxiques ,Leuconostoc, Lactobacillus spp
Quelles sont les particularités de l'artisanat algérien ,richesse
Qu'utilisent les artisans algériens comme matières premières ,modestie des matériaux
Qu'utilisent les artisans algériens comme matières premières ,ressources naturelles
A quoi fait référence la décoration de la production artisanale ,vertus protectrices
Qu'est-ce qui explique la richesse de la création artisanale en Algérie ,diversité des conditions climatiques, des ressources naturelles et les différentes civilisations
A quoi sert l'artisanat algérien ,dans un but utilitaire
A quoi sert l'artisanat algérien ,but utilitaire
qui est l'adversaire de Fénix lors de son premier combat,Matt Sydal
à quel PWG fénix gagne le le championnat,Nice Boys (Don't Play Rock N' Roll
quand fénix est défait par Will Ospreay,2 septembre 2016
qui est défait le 28 août 2015,Fénix
qui est défait le 28 août 2015,Fénix
à quelle ronde fénix est sorti en 2015,premier tour
Combien d'écoles anglaises appartiennent aux 100 meilleures universités en 2018,12
Combien d'écoles anglaises appartiennent aux 100 meilleures universités en 2018,12
où est classée l'université d'oxford en 2018 ,première
quel est le rang de UCL en 2019,dixième
Combien d'écoles anglaises font partie du groupe des dix meilleures en 2018,3
combien d'écoles anglaises sont dans le top 100 en 2019,18
qui est le nouveau général ,Le général Burgoyne
qui est le nouveau général ,général Burgoyne
qui est le nouveau général ,Burgoyne
Où arrivèrent les américains ,Bemis Heights
qui perdit la bataille ,Les Britanniques
