Pour qui observer des animaux est-il toujours une tâche ardue ,pour le plus expérimenté des touristes, ou visiteurs
Quel est le sentiment du public ,surprenant
Qui a lancé un programme pour améliorer les UAZ ,le bureau d'études
Qu'est ce qui est très semblable à une jeep classique ,l'UAZ-469
Quelles sont les charactéristiques de la jeep ,une voiture vigoureuse, sommaire et très rustique qui peut circuler sur - pratiquement - n'importe quel terrain
En quelle année la voiture est-elle disponible à l'achat ,1980
En quelle année la voiture est-elle disponible à l'achat ,en 1980
Qui sont les premiers utilisateurs de la UAZ ,forces de police
Qui sont les premiers utilisateurs de la UAZ ,les forces de police
Quelle bataille a constitué la défaire de la croisade ,Nicopolis
A qui philippe le bel s'est-il opposé ,le pape Boniface VIII
A qui philippe le bel s'est-il opposé ,le pape Boniface VIII
A qui philippe le bel s'est-il opposé ,le pape Boniface VIII
En quelle date les papes sont-ils partis d'Avignon ,1376
Quelles étaient les privilèges du clergé ,l'exemption fiscale et de l'immunité judiciaire
Qui a envoyé des émissaires contre le pape ,Philippe Le Bel
Où la légende est-elle racontée ,Dans le second livre des Maccabées
Qui est Balaq ,le roi de Moab
Que font Balaq et Baalam sur le mont Pisga ,observer le peuple israélite avant le franchissement du Jourdain
Que font Balaq et Baalam sur le mont Pisga ,observer le peuple israélite avant le franchissement du Jourdain
Que fait Jérémie après avoir caché l'arche ,il obstrue l'entrée
Quand l'arche a-t-elle été camouflée ,VIe siècle avant l'ère chrétienne
Quand l'arche a-t-elle été camouflée ,au VIe siècle avant l'ère chrétienne
Où se situe l'arche d'alliance sous le règne du roi Jonas ,à Jérusalem sous le règne du roi Joas mais n'est plus dans le temple de Salomon
Après quel évènement arrête-t-on d'en parler ,Après sa mise en place dans le sanctuaire
A qui le souverain demande-t-il de ne plus porter l'arche ,aux lévites
Qu'est ce qu'Edras ,un livre apocryphe
Qu'est ce qui ne fait pas partie des objets ramenés de Babylone ,L'arche d'alliance
Quel roi a commencé le mouvement de regroupement des fermes ,À partir d'Henri III
Combien de personnes travaillaient à la Ferme générale ,des dizaines de milliers de personnes
Quels sont les pouvoirs initiaux des fermes ,des pouvoirs comme la commercialisation ou la fiscalité
Quels pouvoirs possèdent les agents royaux ,les pouvoirs de justice et de police
A quelle fréquence les fermiers s'engagent-ils à payer des impôts ,chaque année
Quel est le premier impot direct ,Le premier impôt direct qui se généralise est le fouage
Quand la taille devient-elle un monopole royal ,en 1439
Pourquoi les marchandises sont-elles taxées à l'export ,car il est considéré que cela diminue la richesse du royaume
Qui est exempt de la taxe ,Les nobles (qui versent l'impôt du sang) et les clercs
Qui gère la gabelle ,par les grenetiers, des agents royaux qui vendent le sel
Quelle est la forme du corps ,massif et aplati latéralement
Quelle est la forme du corps ,Le corps est massif et aplati latéralement
Qu'y a-t-il au bout des doigts ,munis de fortes griffes
Où sont situées les plus grandes écailles ,sous le tympan
Où sont situées les plus grandes écailles ,une série de grandes écailles rondes et plates est visible sous le tympan
Quelle est la couleur des jeunes tortues ,coloration verte intense chez le jeune
De quelle couleur est le ventre de l'adulte ,blanche ou grisâtre
De quelle couleur est le ventre de l'adulte ,la face ventrale est blanche ou grisâtre
Où se trouve la réserve ,commune de Vireux-Molhain dans les Ardennes
Qu'est ce qui est interdit ,La collecte de fossiles et minéraux
Comment accède-t-on à la réserve ,par un talus en bordure de la « route de Najauge » entre Vireux-Molhain et Treignes
Comment accède-t-on à la réserve ,par un talus en bordure de la « route de Najauge
Dans quelle vallée est-elle située ,Viroin
Dans quelle vallée est-elle située ,le versant nord de la vallée du Viroin
Quelle route passe entre Vireux-Molhain et Treignes ,route de Najauge
Quelle route passe entre Vireux-Molhain et Treignes ,route départementale 47
Qu'est ce que les nazis ont détruit ,les synagogues, en brûlant des livres de prières
Dans quelles proportions les communautés juives d'Europe de l'Est ont elles été décimées , les communautés juives d’Amsterdam, Berlin, Vienne, Budapest ou Vilnius ont été éradiquées sans retour, à plus de 90 %
Comment appelle-t-on le processus d'éradication du passé juif ,aryanisation
Quel pourcentage des locuteurs du yiddish sont mort pendant la guerre ,les trois quarts
Quel pourcentage des locuteurs du yiddish sont mort pendant la guerre ,les trois quarts
Quelle communauté juive a le mieux survécu ,e monde israélite français a survécu malgré la perte d'un quart de la population juive
Aquel âge Gisela Dulko arrive-t-elle sur le circuit WTA ,15 ans
Aquel âge Gisela Dulko arrive-t-elle sur le circuit WTA ,15 ans
Aquel âge Gisela Dulko arrive-t-elle sur le circuit WTA ,15 ans
En quelle année Gisela Dulko arrive-t-elle sur le circuit WTA ,en 2001
Pour quoi Gisela Dulko tente de se qualifier ,le tableau final du tournoi d'Indian Wells
Que remporte Gisela Dulko en 2000 ,l'US Open
Où Gisela Dulko dispute son premier match professionnel ,Miami
Qui est l'interprète du célèbre clown Patof ,Jacques Desrosiers
Qui joue le personnage du Capitaine Bonhomme ,Michel Noël
Qui est dite La Poune ,Rose Ouellette
Qui est dite La Poune ,Rose Ouellette
Pourquoi Marc Favreau est-il célèbre ,son personnage de Sol
Pourquoi Marc Favreau est-il célèbre ,pour son personnage de Sol, un clown clochard
Qu'a fait François Pérusse ,Les 2 Minutes du peuple
Qu'a écrit Anne Robillard ,Chevaliers d'Émeraude, des Héritiers d'Enkidiev et des Chevaliers d'Antares
Où les livres d'Anne Robillard sont-ils connus mondialement ,France et au Québec
Où les livres d'Anne Robillard sont-ils connus mondialement ,en France et au Québec
Qu'est-ce qui forme les futurs acteurs au Qébec ,L'École nationale de théâtre du Canada et le Conservatoire de musique et d'art dramatique du Québec
Qui a écrit les Chevaliers d'Emeraude ,Anne Robillard
Qui a écrit les Héritier d'Enkidiev ,Anne Robillard
Qui a écrit les Héritier d'Enkidiev ,Anne Robillard
Qui a écrit les Héritier d'Enkidiev ,Anne Robillard
Que se passe-t-il le 25 mars 1975 ,Mariner 10 ne dispose plus de carburant pour pouvoir manœuvrer
Que décident les scientifiques le 25 mars  1975 ,clore la mission
Quel pourcentage de Mercure a pu être cartographié ,45 % de la surface de Mercure a pu être cartographiée
Pourquoi seul 45 % de Mercure ont pu être cartographiés ,à chacun des trois survols, Mercure présentait la même face au Soleil
Pourquoi seul 45 % de Mercure ont pu être cartographiés ,car à chacun des trois survols, Mercure présentait la même face au Soleil
Combien de photographies Mariner 10 aura rapporté ,8 000
Combien de photographies Mariner 10 aura rapporté ,près de 8 000 photographies dont 4 000 de Vénus et 3 500 de Mercure ainsi que quelques centaines de photographies de la Lune et de la Terre
Quand à eu lieu le premier survol ,le 29 mars 1974
A quelle altitude eut lieu le premier survol de Mercure ,703 km
A quelle altitude eut lieu le premier survol de Mercure ,703 km d'altitude
Que permet de découvrir le premier survol de Mercure ,un champ magnétique
Que permet de découvrir le premier survol de Mercure ,Mercure possède un champ magnétique
Que dévoilent les premières photo détaillées de la surface de la planète Mercure ,une surface couverte de cratères
Combien de photographies sont prises lors du premier survol de Mercure ,2 300 photographies en moyenne (3–20 km/pixel) et haute résolution
Que fait le bureau des Science Spaciales de l'Académie Nationale des Sciences en 1968 ,produit un rapport sur les missions d'exploration du système solaire
Que recommmande le rapport sur les missions d'exploration du système solaire ,l'envoi d'une mission vers Mercure tout en suggérant certains des équipements scientifiques à embarquer
Que décide la NASA en 1969 ,de programmer la mission de 1973
Que décide la NASA en 1969 ,programmer la mission de 1973
Quand la structure du projet est-elle mise en place ,en janvier 1970
Quand la structure du projet est-elle mise en place ,janvier 1970
Dans quel but, en 1970, Boing est sélectionné ,pour la conception et la fabrication de deux exemplaires de la sonde dont un doit être utilisé pour effectuer les tests
Quelle est la première sonde à exploiter le principe de la voile solaire ,Mariner 10
Que décidèrent d'utiliser les ingénieurs de Mariner 10 suite à une défaillance du système de contrôle d'attitude de la sonde ,pression des photons sur les panneaux solaires
Que décidèrent d'utiliser les ingénieurs de Mariner 10 suite à une défaillance du système de contrôle d'attitude de la sonde ,la pression des photons sur les panneaux solaires
Que devait faire à l'origine Mariner 10 ,survoler Vénus et étudier son atmosphère (composition, structure, pression) et ses nuages
De quoi se sont rendus compte les ingénieurs de la NASA ,avec quelques ajustements, la sonde pourrait atteindre Mercure
Poourquoi les ingénieurs de Mariner 10 ont décidé d'utiliser la pression des protons sur les panneaux solaires  ,pour maintenir l'orientation de la sonde
Poourquoi les ingénieurs de Mariner 10 ont décidé d'utiliser la pression des protons sur les panneaux solaires  ,pour maintenir l'orientation de la sonde en limitant ainsi la quantité de carburant qui aurait été nécessaire pour permettre aux propulseurs d'effectuer les corrections d'orientation nécessaires
Qu'est-ce que Mariner 10 ,la dernière sonde spatiale du programme Mariner de la NASA
Qu'est-ce que Mariner 10 ,la dernière sonde spatiale du programme Mariner de la NASA
Qu'est-ce que Mariner 10 ,la dernière sonde spatiale du programme Mariner de la NASA
Quand la sonde spaciale Mariner 10 fut lancée ,le 3 novembre 1973
Combien de temps après la sonde Mariner 9 la sonde Mariner 10 fut-elle lancée ,deux ans après la sonde
Quelle est la première sonde à avoir effectué un survol de la planète Mercure ,Mariner 10
Quelle est la première sonde à avoir utilisé l'assistance gravitationnelle d'une planète pour modifier sa trajectoire ,Mariner 10
Quel rôle joue le territoire dans sa relation à l'Etat ,Le territoire joue un rôle fondamental : il contribue à fixer la population en favorisant l'idée de nation et détermine le titre et le cadre de compétence de l'État
Où s'arrête l'autorité de l'Etat ,au-delà des frontières
Où s'arrête l'autorité de l'Etat ,Hors de ses frontières, un État est présent par ses représentations diplomatiques (ambassades et consulats
Les lieux des représentations diplomatiques font-ils partie du territoire d'un Etat ,Par convention, ces lieux sont censés faire partie intégrante du territoire de l'État représenté et bénéficient à ce titre - ainsi que du personnel rattaché d'une immunité juridique exceptio
Où s'abolit la souveraineté d'un Etat ,La souveraineté d'un État s'abolit au-delà des frontières
Comment la notion de territoire favorise l'idée de nation ,il contribue à fixer la population en favorisant l'idée de nation
Comment est positionné Forster politiquement ,un farouche opposant à l'Ancien Régime
Comment est positionné Forster politiquement ,un farouche opposant à l'Ancien Régime
Que pense t'il du déclenchement de la révolution française ,une conséquence importante des Lumières
Qui est son beau père ,Christian Gottlob Heyne
Qui est son beau père ,le philologue Christian Gottlob Heyne
Quand est mort son beau-père ,1812
Que s'est-il passé en juillet 1789 ,la prise de la Bastille
Où va Forster en 1790 ,Pays-Bas autrichiens, en Hollande, en Angleterre et à Paris
Que pense Goethe de ce livre ,On aime, quand on est à la fin, recommencer au début, et on apprécierait de voyager avec un observateur si bon et si cultivé
S'où par il pour rejoindre les Pays-Bas Autrichiens en 1790 ,Mayence
S'où par il pour rejoindre les Pays-Bas Autrichiens en 1790 ,De Mayence
Comment s'appelle le livre de Forster publié en 1791 et 1794 ,Ansichten vom Nierderrhein, von Brabant, Flandern, Holland, England und Frankreich im April, Mai und Juni 1790
Combien de volumes ,trois
Comment écrit Forster ,prose allemande raffinée, scientifiquement exacte et objectivement fondée
Comment écrit Forster ,dans une prose allemande raffinée
Pourquoi l'oeuvre de Forster est-il différent ,"parce qu'elles ne représentent pas une succession de dates pures , cohérentes"
Que propose le livre de Forster ,des faits ethnologiquement parlants et sûrs
En quelle langue écrit forster ,allemande
Quel genre littéraire Forster ,littérature de voyage
Comment s'appelle le livre de Georg Foster sur le voyage de James Cook ,A Voyage round the World in His Britannic Majesty's Sloop Resolution
Comment s'appelle le livre de Georg Foster sur le voyage de James Cook ,Voyage autour du monde
Comment s'appelle le livre de Georg Foster sur le voyage de James Cook ,A Voyage round the World in His Britannic Majesty's Sloop Resolution, Commanded by Capt. James Cook, during the Years
Qui a écrit A voyage round the World in His British Majesty's Sloop resolution ,Georg Forster
Qui a écrit A voyage round the World in His British Majesty's Sloop resolution ,Georg Forster
Date de naissance de Alexander von Humboldt ,1769
Date de mort de Martin Wieland ,1813
Quand est publié le livre de Goerg Forster sur James Cook ,1778-1780
Quel était le sujet de l'ouvrage de Morgan,les Iroquois
Quel était le sujet de l'ouvrage de Morgan,les Iroquois
Quel est le schéma d'adaptation des croyances selon Frazer,animiste, polythéiste, monothéiste
Quel est le schéma d'adaptation des croyances selon Frazer,de la magie à la science en passant par la religion
Dans quel ouvrage Frazer expose sa théorie des stades d'évolution de la société,Ancient Society
quel type d'anthropologie est traitée par Tylor,anthropologie sociale, notamment la religion
Quelle est la nationalité de l'anthropologue Frazer,britannique
Qui tue Cedric ,Peter Pettigrow
Quand devient il capitaine de l'équipe de Quidditch ,En 1993
Qui commandite le meurtre de Cedric,Voldemort
Qui commandite le meurtre de Cedric,Voldemort
Comment s'appelle la copine de Cedric dont Harry est jaloux ,Cho Chang
Comment s'appelle la copine de Cedric dont Harry est jaloux ,Cho Chang
Quand est né Cedric ,1977
Quand est né Cedric ,1977
Quand est né Cedric ,en 1977
Ou Harry le rencontre t il pour la première fois ,en haut de la colline Têtafouine
Ou Harry le rencontre t il pour la première fois ,en haut de la colline Têtafouine
Dans quel objet est le portoloin pour la coupe du monde de quidditch,une vieille botte
Comment s'appelle le père de Cédric Diggory,Amos Diggory
Comment s'appelle le père de Cédric Diggory,Amos Diggory
Comment s'appelle le père de Cédric Diggory,Amos
Dans quel département du ministère travaille-t-il,contrôle et de régulation des créatures magiques
Près de quelle ville habitent les Diggory,Loutry Ste Chaspoule
Près de quelle ville habitent les Diggory,Loutry Ste Chaspoule
Près de quelle ville habitent les Diggory,Loutry Ste Chaspoule
Ou est logé l'ordre du phénix à Londres,12, square Grimmaurd
Ou est logé l'ordre du phénix à Londres,12, square Grimmaurd
Avec qui vient il dans la maison d'Harry Potter,Hestia Jones
Dans quel livre Harry visite t il le chemin de traverse,Harry Potter à l'école des sorciers
Dans quel livre les Dursley sont ils exfiltrés de leur maison,Harry Potter et les Reliques de la Mort
Dans quel livre les Dursley sont ils exfiltrés de leur maison,Harry Potter et les Reliques de la Mort
Quel est le ministère dans lequel il travaille,ministère de la Magie
Quel est le ministère dans lequel il travaille,ministère de la Magie
En quelle année le siège de l'Exelsior est il déplacé ,1922
Quel est le classement de l'Exelsior AC en 1930-31 ,troisième
Quel est le classement de l'Exelsior AC en 1930-31 ,troisième
Quand est ce que la Ligue du Nord est née ,1919
Quand est ce que la Ligue du Nord est née ,1919
Quel club occupait le stade Amédée-Prouvost jusqu'en 1928,Football Club de Roubaix
Quel club occupait le stade Amédée-Prouvost jusqu'en 1928,Football Club de Roubaix
qui occupe le stade Amédée-Prouvost en 1934,Excelsior Athlétic Club
Qui a organisé le premier championnat national de football en France,USFSA
Quel club de football français remporte cinq fois le championnat national dans les années 1900,le Racing Club de Roubaix
Quelle est l'année de naissance de l'US Tourcoing ,1902
Quelle est l'année de naissance de l'US Tourcoing ,1902
Quand Lille a t il remporté son premier titre de champion,1914
Quand Lille a t il remporté son premier titre de champion,1914
Quand le Racing Club de Roubaix a-t-il été créé,1895
En quelle année le CO Roubaix Tourcoing a disparu ,l'aventure du CO Roubaix-Tourcoing s'arrête en 1970
Sous quel nom le CO Roubaix-Tourcoing a t il été relancé ,Il repart sous le nom d'Excelsior AC Roubaix
En quelle année le club de Roubaix Tourcoing perd il le statut professionel,le club est contraint d'abandonner le statut professionnel en 1963
Quand est la dernière saison du CO Roubaix-Tourcoing en Division 1,Il ne peut éviter la relégation en Division 2 à l'issue de la saison 1954-1955
Quand l'Excelsior AC Roubaix a t il disparu ,en 1990
Quand l'Excelsior AC Roubaix a t il disparu ,1990
Quand l'Excelsior AC Roubaix a t il disparu ,1990
Quels ingrédients la cuisine algérienne utilise-t-elle depuis l'antiquité ,légumes et céréales
Quelles sont les influences présentes dans la cuisine algérienne ,cuisine méditerranéenne et saharienne
À quels produits l'algérie doit-elle le surnom de grenier de Rome ,céréales
Quelles ont été les influences méditerranéennes sur la cuisine algérienne ,berbères, arabes, turcs, juifs, andalous, français et espagnols
Comment s'est produite l'influence extérieure sur la cuisine algérienne ,les conquêtes du territoire algérien
Quel style de musique a-t-il été influencé par le Diwan dans le nord de l'Algérie ,sétifienne
Quel style de musique a-t-il été influencé par le Diwan dans le nord de l'Algérie ,la musique sétifienne
Dans quelle région du monde s'est développée la musique chaouie ,Algérie
Quel est l'instrument de musique traditionnel joué par Biyat Edaber en musique chaoui ,Imzad
Quel est l'instrument de musique traditionnel joué par Biyat Edaber en musique chaoui ,Imzad
Quel style de musique traditionnelle est caractéristique de l'extrême sud-est de l'Algérie ,La musique terguie
Quel style de musique traditionnelle est caractéristique de l'extrême sud-est de l'Algérie ,terguie
Quel style de musique traditionnelle est caractéristique de l'extrême sud-est de l'Algérie ,La musique terguie
D'où vient la musique chaouie ,les régions des Aurès
Combien d'équipes en D-League ,16 franchises
Quel est le nom de l'équipe de Frisco ,Legends du Texas
Combien de joueurs vont en NBA ,À l'issue de la saison NBA 2013-2014, 33 % des joueurs NBA ont évolué en NBA D-League, alors qu'ils étaient 23 % en 2011
De quel coin est l'équipe des Red Claws ,Maine
Où est l'équipe de l'Arsenal ,Springfield
Comment d'années d'expérience pour aller en D-League ,deux ans
A combien de joueurs peuvent faire appel les franchises NBA ,autant de joueurs qu'elles désirent
Quand ont été signé les accord avec la NBA ,été 2005
Combien de joueurs peuvent être placé par chaque club ,deux de ses joueurs
Entre qui ont été signés les accords ,les propriétaires d'équipes et l'association des joueurs NBA
La NBA Development League c'est quoi ,une véritable ligue mineure
La NBA Development League c'est quoi ,une véritable ligue mineure permettant aux plus jeunes joueurs de prendre de l'expérience et, pour les franchises, de bénéficier d'un vivier de joueurs
Quel est l'ancien nom de la NBA Development League ,NBDL
Quel est l'ancien nom de la NBA Development League ,NBDL (National Basketball Development League
Qui voulait changer le système de la NBDL ,David Stern
Quand a eu lieu la première saison de la NBDL ,2001-2002
Comment distinguer les types de bruit ,par la densité spectrale
"Qu'est ce que la ""couleur"" d'un bruit ",classification par la densité spectrale
Quelles sont les disciplines pour lesquelles le bruit est important ,acoustique, la musique, l'électrotechnique et la physique
Quelles sont les disciplines pour lesquelles le bruit est important ,acoustique, la musique, l'électrotechnique et la physique
Quelle particularité ont les bruits ,propriétés statiques caractéristiques
Quel type de signal est un bruit ,un signal aléatoire
Dans quelle ville Jean-Louis Cheynet a-t'il étudié ,Grenoble
Dans quelle ville Jean-Louis Cheynet a-t'il étudié ,Grenoble
Dans quelle ville Jean-Louis Cheynet a-t'il étudié ,Grenoble
Qui est le beau-père de Jean-Louis Cheynet ,Jacques-Daniel, avocat du roi en l'échevinage de Montélimar, seigneur du Roure à Châteauneuf-du-Rhône, capitaine des chasses du prince de Monaco
Qui est le beau-père de Jean-Louis Cheynet ,Jacques-Daniel
Quel métier exerce Jean-Louis Cheynet après sa formation ,avocat au parlement de Grenoble
Quel métier exerce Jean-Louis Cheynet après sa formation ,avocat au parlement de Grenoble
Quelle est le rôle qu'exerce le beau-père de M. Cheynet à Monaco ,capitaine des chasses du prince de Monaco
Que fait-il après son départ de Grenoble ,Il revient ensuite habiter sa ville natale
Qui est le grand-père de Louis Cheynet ,Jean-André Michel
Qui est la grand-mère du consul de Montélimar ,Jean-André Michel
Qui est la grand-mère du consul de Montélimar ,Louise Loubaud
Comment s'appelle le consul de Montélimar mort en 1707 ,Charles Cheynet
En plus du grand-père, du frère et du bisaïeul de Louis, qui a également été consul dans la famille ,nombre de ses cousins, oncles ou grands-oncles Cheynet
Quand est mort Louis Cheynet ,1791
Qu'est ce que la fille du gouverneur a distingué à l'horizon ,un navire aux voiles déchirées noires, le Black Pearl
Qu'est ce qu'Elizabeth décide de cacher ,un médaillon en or
Qu'est ce qu'Elizabeth décide de cacher ,un médaillon en or
Qu'est ce qu'Elizabeth décide de cacher ,un médaillon en or
Pourquoi Will Turner possède un médaillon en or ,il est en fait un pirate
Quelle est la destination du gouverneur et de sa fille ,Port Royal (en Jamaïque
À quelle époque se déroule cette histoire ,Au milieu du XVIIIe siècle
En quelle année les Américains doivent faire face à un bas niveau de réserves d'eau ,1801
Qui commandait la goélette Enterprise ,le lieutenant Andrew Sterett
Comment l'Enterprise a-t-elle trompé l'ennemi ,fait hisser les couleurs britanniques
Dans quel pays Dale a-t-il ordonné d'aller se ravitailler ,Malte
Quelle était la nationalité du navire rencontré par l'Enterprise en route pour Malte ,tripolitain
Quelle était la nationalité du navire rencontré par l'Enterprise en route pour Malte ,tripolitain
Pourquoi le gisement était-il prisé des paléontologues ,Le gisement a été très fréquenté par les paléontologues en raison de la profusion de fossiles, la qualité de leur conservation et la diversité des espèces présentes
quand a-t-on observé un pic de fréquentation ,Dans les années 1980
Le site était-il ouvert aux amateurs ou réservé aux professionnels ,il a fait l'objet d'extractions intensives de la part d'amateurs comme de professionnels
Comment expliquer les abus d'extraction du site ,L'abondance de fossiles et la facilité d'accès au site
Pourquoi les découvertes n'ont-elles pu toutes être exploitées scientifiquement ,la fréquentation était devenue si importante
Qui a été condamné à la plus faible amende,le directeur technique de l'Inter Gabriele Oriali
Qui a été condamné à la plus faible amende,le directeur technique de l'Inter Gabriele Oriali
Quel fait a permis, rétroactivement, aux deux clubs d'éviter une sanction pénale ,la modification de la loi sur la fraude fiscale
Quelle période fiscale était concernée par les soupçons de falsification ,2003-2004
Quand les deux clubs ont-ils été lavés de tout soupçon ,En janvier 2008
Quand s'est tenu le procès pour falsification de comptes ,le procès pénal n'a pas eu lieu
Combien le club compte-t-il d'actionnaires ,des centaines
Combien le club compte-t-il d'actionnaires ,des centaines
Qui préside la société ,Erick Thohir
Qui préside la société ,Erick Thohir
Qui gère le stade Giuseppe-Meazza ,Consorzio San Siro 2000
Qui gère le stade Giuseppe-Meazza ,le Consorzio San Siro 2000
Qui est l'actionnaire exclusif de Inter Futura SrL ,l'Inter
Qui est l'actionnaire majoritaire de la Football Club Internazionale Milano S.p.A. ,Suning Holdings Group
Pourquoi le stade permet-il de jouer en hiver sans problèmes  ,recouverte par un chapiteau mobile
Pourquoi le stade permet-il de jouer en hiver sans problèmes  ,recouverte par un chapiteau mobile
Pourquoi le stade permet-il de jouer en hiver sans problèmes  ,recouverte par un chapiteau mobile
Quelle est l'aire des gymnases ,un de 250 m2 et un de 100 m2
Dans combien d'endroits peut-on se faire osculter ,deux salles médicales
Dans combien d'endroits peut-on se faire osculter ,deux
Qui a piloté les travaux du terrain couvert ,Corrado Orrico
Qui a piloté les travaux du terrain couvert ,Corrado Orrico
Comment appelle-t-on également le terrain équipé d'un chapiteau mobile ,cage
Comment appelle-t-on également le terrain équipé d'un chapiteau mobile ,"la ""cage"
